{
  "artifact_type": "verification_report_v1",
  "schema_version": "0.1.0",
  "protocol_version": "1.0",
  "agreement_id": "agr-001",
  "revision_id": "rev-001",
  "verification_id": "vr-001",
  "integrity_decision": "PASS",
  "acceptance_decision": "PARTIAL_ACCEPT",
  "created_at": "2026-03-18T00:04:00Z"
}
